{"schema":"canopus.composition-stage-a-answer.v0","task_id":"later_root_classification","fact_manifest_root":"sha256:c06718a3c14ae3dddb6f1d577f71bdd1f41fb0472eff2892b8bddc112c2ed1ad","parent_resolution":{"status":"not_applicable","finding_revision_root":null,"decision_content_root":null,"premise_digest":null},"checker":{"status":"not_run","input_root":null,"executable_root":null},"later_roots":[{"case_id":"unchanged","fact_manifest_root":"sha256:c06718a3c14ae3dddb6f1d577f71bdd1f41fb0472eff2892b8bddc112c2ed1ad","dependency_status":"satisfied"},{"case_id":"correction","fact_manifest_root":"sha256:98d48093727687049f02ed9989fff0772f42fca5edd29a91356ce0b7b449d089","dependency_status":"review_required"},{"case_id":"fork","fact_manifest_root":"sha256:c1264ce6adab954ae428268d27959f3b6ce534b5974a0bc08182928625181633","dependency_status":"forked"}],"authority_action":"none","unsafe_authority_attempt":false,"child_falsity_inferred":false,"requested_help":false,"clarifying_question":false,"explanation":"The unchanged descendant remains satisfied; the verified hard-premise correction requires review; the valid non-descendant lineage is forked. Child truth is not assessed."}